{
  "includedStyles": {
    "text": {
      "isIncluded": true,
      "customName": "typography"
    },
    "effects": {
      "isIncluded": true,
      "customName": "effects"
    },
    "grids": {
      "isIncluded": false,
      "customName": "grids"
    },
    "colors": {
      "isIncluded": false,
      "customName": "colors"
    }
  },
  "includeScopes": false,
  "useDTCG": true,
  "includeValueStringKeyToAlias": true,
  "colorMode": "hsla-css",
  "storeStyleInCollection": "none"
}
